id,title,year,vote_count,vote_average,popularity,overview,release_date,wr
155,The Dark Knight,2008,12269,8,123.167259,"Batman raises the stakes in his war on crime. With the help of Lt. Jim Gordon and District Attorney Harvey Dent, Batman sets out to dismantle the remaining criminal organizations that plague the streets. The partnership proves to be effective, but they soon find themselves prey to a reign of chaos unleashed by a rising criminal mastermind known to the terrified citizens of Gotham as the Joker.",2008-07-16,7.957676677493461
680,Pulp Fiction,1994,8670,8,140.95023600000002,"A burger-loving hit man, his philosophical partner, a drug-addled gangster's moll and a washed-up boxer converge in this sprawling, comedic crime caper. Their adventures unfurl in three stories that ingeniously trip back and forth in time.",1994-09-10,7.940521601224353
278,The Shawshank Redemption,1994,8358,8,51.645403,"Framed in the 1940s for the double murder of his wife and her lover, upstanding banker Andy Dufresne begins a new life at the Shawshank prison, where he puts his accounting skills to work for an amoral warden. During his long stretch in prison, Dufresne comes to be admired by the other inmates -- including an older prisoner named Red -- for his integrity and unquenchable sense of hope.",1994-09-23,7.938355493624583
238,The Godfather,1972,6024,8,41.109264,"Spanning the years 1945 to 1955, a chronicle of the fictional Italian-American Corleone crime family. When organized crime family patriarch, Vito Corleone barely survives an attempt on his life, his youngest son, Michael steps in to take care of the would-be killers, launching a campaign of bloody revenge.",1972-03-14,7.915272552892005
807,Se7en,1995,5915,8,18.45743,"Two homicide detectives are on a desperate hunt for a serial killer whose crimes are based on the ""seven deadly sins"" in this dark and haunting film that takes viewers from the tortured remains of one victim to the next. The seasoned Det. Sommerset researches each sin in an effort to get inside the killer's mind, while his novice partner, Mills, scoffs at his efforts to unravel the case.",1995-09-22,7.913764528572551
274,The Silence of the Lambs,1991,4549,8,4.307222,"FBI trainee, Clarice Starling ventures into a maximum-security asylum to pick the diseased brain of Hannibal Lecter, a psychiatrist turned homicidal cannibal. Starling needs clues to help her capture a serial killer. but her Faustian relationship with Lecter soon leads to his escape, and now two deranged killers are on the loose.",1991-02-01,7.8890072401654345
101,Leon: The Professional,1994,4293,8,20.477329,"Leon, the top hit man in New York, has earned a rep as an effective ""cleaner"". But when his next-door neighbors are wiped out by a loose-cannon DEA agent, he becomes the unwilling custodian of 12-year-old Mathilda. Before long, Mathilda's thoughts turn to revenge, and she considers following in Leon's footsteps.",1994-09-14,7.882695930661503
497,The Green Mile,1999,4166,8,19.96678,"A supernatural tale set on death row in a Southern prison, where gentle giant John Coffey possesses the mysterious power to heal people's ailments. When the cellblock's head guard, Paul Edgecomb, recognizes Coffey's miraculous gift, he tries desperately to help stave off the condemned man's execution.",1999-12-10,7.879290838936517
500,Reservoir Dogs,1992,3821,8,12.22034,"A botched robbery indicates a police informant, and the pressure mounts in the aftermath at a warehouse. Crime begets violence as the survivors -- veteran Mr. White, newcomer Mr. Orange, psychopathic parolee Mr. Blonde, bickering weasel Mr. Pink and Nice Guy Eddie -- unravel.",1992-09-02,7.868957432676896
240,The Godfather: Part II,1974,3418,8,36.629307,"In the continuing saga of the Corleone crime family, a young Vito Corleone grows up in Sicily and in 1910s New York. In the 1950s, Michael Corleone attempts to expand the family business into Las Vegas, Hollywood and Cuba.",1974-12-20,7.8543975488492626
629,The Usual Suspects,1995,3334,8,16.302466,"Held in an L.A. interrogation room, Verbal Kint attempts to convince the feds that a mythic crime lord, Keyser Soze, not only exists, but was also responsible for drawing him and his four partners into a multi-million dollar heist that ended with an explosion in San Pedro harbor – leaving few survivors. Verbal lures his interrogators with an incredible story of the crime lord's almost supernatural prowess.",1995-07-19,7.850945598326652
769,GoodFellas,1990,3211,8,15.424092000000002,"The true story of Henry Hill, a half-Irish, half-Sicilian Brooklyn kid who is adopted by neighbourhood gangsters at an early age and climbs the ranks of a Mafia family under the guidance of Jimmy Conway.",1990-09-12,7.845585026587281
111,Scarface,1983,3017,8,11.299673,"After getting a green card in exchange for assassinating a Cuban government official, Tony Montana stakes a claim on the drug trade in Miami. Viciously murdering anyone who stands in his way, Tony eventually becomes the biggest drug lord in the state, controlling nearly all the cocaine that comes through Miami. But increased pressure from the police, wars with Colombian drug cartels and his own drug-fueled paranoia serve to fuel the flames of his eventual downfall.",1983-12-08,7.836299355082347
103,Taxi Driver,1976,2632,8,14.092713,"A mentally unstable Vietnam War veteran works as a night-time taxi driver in New York City where the perceived decadence and sleaze feeds his urge for violent action, attempting to save a preadolescent prostitute in the process.",1976-02-07,7.814116134395537
598,City of God,2002,1852,8,14.959270000000002,"Cidade de Deus is a shantytown that started during the 1960s and became one of Rio de Janeiro’s most dangerous places in the beginning of the 1980s. To tell the story of this place, the movie describes the life of various characters, all seen by the point of view of the narrator, Buscapé. Buscapé was raised in a very violent environment. Despite the feeling that all odds were against him, he finds out that life can be seen with other eyes: The eyes of an artist. By accident, he becomes a professional photographer, gaining his freedom.",2002-02-05,7.743770486357363
311,Once Upon a Time in America,1984,1104,8,32.182851,"A former Prohibition-era Jewish gangster returns to the Lower East Side of Manhattan over thirty years later, where he once again must confront the ghosts and regrets of his old life.",1984-02-16,7.597810790824125
548,Rashomon,1950,471,8,9.887355,"In ancient Japan a crime take place as told from three different travelers who have experienced the crime: a man being killed and his wife being raped. Which if any of the stories is true? An Akira Kurosawa film about morals, truth, and communication.",1950-12-26,7.223475002839522
832,M,1931,465,8,12.752421,"In this classic German thriller, Hans Beckert, a serial killer who preys on children, becomes the focus of a massive Berlin police manhunt. Beckert's heinous crimes are so repellant and disruptive to city life that he is even targeted by others in the seedy underworld network. With both cops and criminals in pursuit, the murderer soon realizes that people are on his trail, sending him into a tense, panicked attempt to escape justice.",1931-05-11,7.216563342873696
411088,The Invisible Guest,2016,395,8,13.90698,"""The Invisible Guest” turns on a young businessman who wakes up in a hotel room locked from the inside with the dead body of his lover next to him. He hires a prestigious lawyer, and over one night they work together to clarify what happened in a frenetic race against time.",2016-12-15,7.1257827337049475
654,On the Waterfront,1954,368,8,18.211092999999998,"Terry Malloy dreams about being a prize fighter, while tending his pigeons and running errands at the docks for Johnny Friendly, the corrupt boss of the dockers union. Terry witnesses a murder by two of Johnny's thugs, and later meets the dead man's sister and feels responsible for his death. She introduces him to Father Barry, who tries to force him to provide information for the courts that will smash the dock racketeers.",1954-06-22,7.08488190856205
49026,The Dark Knight Rises,2012,9263,7,20.58258,"Following the death of District Attorney Harvey Dent, Batman assumes responsibility for Dent's crimes to protect the late attorney's reputation and is subsequently hunted by the Gotham City Police Department. Eight years later, Batman encounters the mysterious Selina Kyle and the villainous Bane, a new terrorist leader who overwhelms Gotham's finest. The Dark Knight resurfaces to protect a city that has branded him an enemy.",2012-07-16,6.96632059938463
272,Batman Begins,2005,7511,7,28.505340999999998,"Driven by tragedy, billionaire Bruce Wayne dedicates his life to uncovering and defeating the corruption that plagues his home, Gotham City.  Unable to work within the system, he instead creates a new identity, a symbol of fear for the criminal underworld - The Batman.",2005-06-10,6.958677394001522
106646,The Wolf of Wall Street,2013,6768,7,16.382422000000002,"A New York stockbroker refuses to cooperate in a large securities fraud case involving corruption on Wall Street, corporate banking world and mob infiltration. Based on Jordan Belfort's autobiography.",2013-12-25,6.954276898629969
207703,Kingsman: The Secret Service,2015,6069,7,28.224211999999998,The story of a super-secret spy organization that recruits an unrefined but promising street kid into the agency's ultra-competitive training program just as a global threat emerges from a twisted tech genius.,2015-01-29,6.949186115135336
10528,Sherlock Holmes,2009,5883,7,15.68604,"Eccentric consulting detective, Sherlock Holmes and Doctor John Watson battle to bring down a new nemesis and unravel a deadly plot that could destroy England.",2009-12-23,6.947634698943084
75656,Now You See Me,2013,5635,7,17.852022,An FBI agent and an Interpol detective track a team of illusionists who pull off bank heists during their performances and reward their audiences with the money.,2013-05-29,6.945412527066811
24,Kill Bill: Vol. 1,2003,5091,7,25.261865,"An assassin is shot at the altar by her ruthless employer, Bill and other members of their assassination circle – but 'The Bride' lives to plot her vengeance. Setting out for some payback, she makes a death list and hunts down those who wronged her, saving Bill for last.",2003-10-10,6.93980969216263
23483,Kick-Ass,2010,4747,7,17.26045,"Dave Lizewski is an unnoticed high school student and comic book fan who one day decides to become a super-hero, even though he has no powers, training or meaningful reason to do so.",2010-03-22,6.93563191812739
1422,The Departed,2006,4455,7,18.515448000000003,"To take down South Boston's Irish Mafia, the police send in one of their own to infiltrate the underworld, not realizing the syndicate has done likewise. While an undercover cop curries favor with the mob kingpin, a career criminal rises through the police ranks. But both sides soon discover there's a mole among them.",2006-10-05,6.931602098889637
273248,The Hateful Eight,2015,4405,7,20.328822,Bounty hunters seek shelter from a raging blizzard and get caught up in a plot of betrayal and deception.,2015-12-25,6.930860915331518
393,Kill Bill: Vol. 2,2004,4061,7,21.533072,"The Bride unwaveringly continues on her roaring rampage of revenge against the band of assassins who had tried to kill her and her unborn child. She visits each of her former associates one-by-one, checking off the victims on her Death List Five until there's nothing left to do … but kill Bill.",2004-04-16,6.9252910586241905
58574,Sherlock Holmes: A Game of Shadows,2011,3971,7,18.695329,"There is a new criminal mastermind at large (Professor Moriarty) and not only is he Holmes’ intellectual equal, but his capacity for evil and lack of conscience may give him an advantage over the  detective.",2011-11-22,6.9236825313823
640,Catch Me If You Can,2002,3917,7,19.833077,"A true story about Frank Abagnale Jr. who, before his 19th birthday, successfully conned millions of dollars worth of checks as a Pan Am pilot, doctor, and legal prosecutor. An FBI agent makes it his mission to put him behind bars. But Frank not only eludes capture, he revels in the pursuit.",2002-12-25,6.922683732684898
161,Ocean's Eleven,2001,3857,7,12.114932000000001,"Less than 24 hours into his parole, charismatic thief Danny Ocean is already rolling out his next plan: In one night, Danny's hand-picked crew of specialists will attempt to steal more than $150 million from three Las Vegas casinos. But to score the cash, Danny risks his chances of reconciling with ex-wife, Tess.",2001-12-07,6.921542841895468
64690,Drive,2011,3832,7,15.388875,A Hollywood stunt performer who moonlights as a wheelman for criminals discovers that a contract has been put on him after a heist gone wrong.,2011-08-06,6.921057471834688
37257,Witness for the Prosecution,1957,278,8,9.730217,"When Leonard Vole is arrested for the sensational murder of a rich, middle-aged widow, the famous Sir Wilfrid Robarts agrees to appear on his behalf. Sir Wilfrid, recovering from a near-fatal heart attack, is supposed to be on a diet of bland, civil suits – but the lure of the criminal courts is too much for him, especially when the case is so difficult.",1957-12-17,6.915798294869962
242582,Nightcrawler,2014,3475,7,21.277073,"When Lou Bloom, desperate for work, muscles into the world of L.A. crime journalism, he blurs the line between observer and participant to become the star of his own story. Aiding him in his effort is Nina, a TV-news veteran.",2014-10-23,6.913407711362655
187017,22 Jump Street,2014,3375,7,10.901496,"After making their way through high school (twice), big changes are in store for officers Schmidt and Jenko when they go deep undercover at a local college. But when Jenko meets a kindred spirit on the football team, and Schmidt infiltrates the bohemian art major scene, they begin to question their partnership. Now they don't have to just crack the case - they have to figure out if they can have a mature relationship. If these two overgrown adolescents can grow from freshmen into real men, college might be the best thing that ever happened to them.",2014-06-05,6.910991699291638
146233,Prisoners,2013,3183,7,11.96262,"When Keller Dover's daughter and her friend go missing, he takes matters into his own hands as the police pursue multiple leads and the pressure mounts. But just how far will this desperate father go to protect his family?",2013-09-18,6.905953642118794
6977,No Country for Old Men,2007,3083,7,15.565484,"Llewelyn Moss stumbles upon dead bodies, $2 million and a hoard of heroin in a Texas desert, but methodical killer Anton Chigurh comes looking for it, with local sheriff Ed Tom Bell hot on his trail. The roles of prey and predator blur as the violent pursuit of money and justice collide.",2007-11-08,6.903096913651213
115,The Big Lebowski,1998,3001,7,15.952523999999999,"Jeffrey ""The Dude"" Lebowski, a Los Angeles slacker who only wants to bowl and drink white Russians, is mistaken for another Jeffrey Lebowski, a wheelchair-bound millionaire, and finds himself dragged into a strange series of events involving nihilists, adult film producers, ferrets, errant toes, and large sums of money.",1998-03-06,6.900621584820148
156022,The Equalizer,2014,2997,7,17.618057,"In The Equalizer, Denzel Washington plays McCall, a man who believes he has put his mysterious past behind him and dedicated himself to beginning a new, quiet life. But when McCall meets Teri (Chloë Grace Moretz), a young girl under the control of ultra-violent Russian gangsters, he can’t stand idly by – he has to help her. Armed with hidden skills that allow him to serve vengeance against anyone who would brutalize the helpless, McCall comes out of his self-imposed retirement and finds his desire for justice reawakened. If someone has a problem, if the odds are stacked against them, if they have nowhere else to turn, McCall will help. He is The Equalizer.",2014-09-24,6.900497598150762
107,Snatch,2000,2953,7,14.014025,"The second film from British director Guy Ritchie. Snatch tells an obscure story similar to his first fast-paced crazy character-colliding filled film “Lock, Stock and Two Smoking Barrels.” There are two overlapping stories here – one is the search for a stolen diamond, and the other about a boxing promoter who’s having trouble with a psychotic gangster.",2000-09-01,6.899113041785889
187,Sin City,2005,2755,7,15.010525,"Welcome to Sin City. This town beckons to the tough, the corrupt, the brokenhearted. Some call it dark… Hard-boiled. Then there are those who call it home — Crooked cops, sexy dames, desperate vigilantes. Some are seeking revenge, others lust after redemption, and then there are those hoping for a little of both. A universe of unlikely and reluctant heroes still trying to do the right thing in a city that refuses to care.",2005-04-01,6.892373856965405
627,Trainspotting,1996,2737,7,19.348466000000002,"Renton, deeply immersed in the Edinburgh drug scene, tries to clean up and get out, despite the allure of the drugs and influence of friends.",1996-02-23,6.891716285744258
641,Requiem for a Dream,2000,2525,7,6.874828,The hopes and dreams of four ambitious people are shattered when their drug addictions begin spiraling out of control. A look into addiction and how it overcomes the mind and body.,2000-10-27,6.883320050265593
51497,Fast Five,2011,2491,7,1.420361,"Former cop Brian O'Conner partners with ex-con Dom Toretto on the opposite side of the law. Since Brian and Mia Toretto broke Dom out of custody, they've blown across many borders to elude authorities. Now backed into a corner in Rio de Janeiro, they must pull one last job in order to gain their freedom.",2011-04-20,6.881850801611481
65754,The Girl with the Dragon Tattoo,2011,2479,7,8.907829,"This English-language adaptation of the Swedish novel by Stieg Larsson follows a disgraced journalist, Mikael Blomkvist, as he investigates the disappearance of a weary patriarch's niece from 40 years ago. He is aided by the pierced, tattooed, punk computer hacker named Lisbeth Salander. As they work together in the investigation, Blomkvist and Salander uncover immense corruption beyond anything they have ever imagined.",2011-12-14,6.881323369454693
273481,Sicario,2015,2465,7,19.511221,"A young female FBI agent joins a secret CIA operation to take down a Mexican cartel boss, a job that ends up pushing her ethical and moral values to the limit.",2015-09-17,6.8807020490748885
290250,The Nice Guys,2016,2382,7,16.075615,A private eye investigates the apparent suicide of a fading porn star in 1970s Los Angeles and uncovers a conspiracy.,2016-05-15,6.876880610331966
328387,Nerve,2016,2262,7,14.9837,"Industrious high school senior, Vee Delmonico, has had it with living life on the sidelines. When pressured by friends to join the popular online game Nerve, Vee decides to sign up for just one dare in what seems like harmless fun. But as she finds herself caught up in the thrill of the adrenaline-fueled competition partnered with a mysterious stranger, the game begins to take a sinister turn with increasingly dangerous acts, leading her into a high stakes finale that will determine her entire future.",2016-07-27,6.870901764166225
176,Saw,2004,2255,7,23.508433,"Obsessed with teaching his victims the value of life, a deranged, sadistic serial killer abducts the morally wayward. Once captured, they must face impossible choices in a horrific game of survival. The victims must fight to win their lives back, or die trying...",2004-10-01,6.870535022698413
4638,Hot Fuzz,2007,2252,7,13.535195000000002,"Top London cop, PC Nicholas Angel is good. Too good.  To stop the rest of his team from looking bad, he is reassigned to the quiet town of Sandford, paired with simple country cop, and everything seems quiet until two actors are found decapitated. It is addressed as an accident, but Angel isn't going to accept that, especially when more and more people turn up dead.",2007-02-14,6.8703772091467865
1359,American Psycho,2000,2128,7,13.686715,"A wealthy New York investment banking executive hides his alternate psychopathic ego from his co-workers and friends as he escalates deeper into his illogical, gratuitous fantasies.",2000-04-13,6.86349978581625
339403,Baby Driver,2017,2083,7,228.032744,"After being coerced into working for a crime boss, a young getaway driver finds himself taking part in a heist doomed to fail.",2017-06-28,6.860819924711469
275,Fargo,1996,2080,7,12.61469,"Jerry, a small-town Minnesota car salesman is bursting at the seams with debt... but he's got a plan. He's going to hire two thugs to kidnap his wife in a scheme to collect a hefty ransom from his wealthy father-in-law. It's going to be a snap and nobody's going to get hurt... until people start dying. Enter Police Chief Marge, a coffee-drinking, parka-wearing - and extremely pregnant - investigator who'll stop at nothing to get her man. And if you think her small-time investigative skills will give the crooks a run for their ransom... you betcha!",1996-04-05,6.86063752104808
1949,Zodiac,2007,2080,7,19.083823000000002,"The true story of the investigation of 'The Zodiac Killer',  a serial killer who terrified the San Francisco Bay Area, taunting police with his ciphers and letters. The case becomes an obsession for four men as their lives and careers are built and destroyed by the endless trail of clues.",2007-03-02,6.86063752104808
3131,Gangs of New York,2002,1964,7,14.922398999999999,"It's 1863. America was born in the streets. Amsterdam Vallon returns to the Five Points of America to seek vengeance against the psychotic gangland kingpin, Bill the Butcher, who murdered his father years earlier. With an eager pickpocket by his side and a whole new army, Vallon fights his way to seek vengeance on the Butcher and restore peace in the area.",2002-12-14,6.853198356923822
949,Heat,1995,1886,7,17.924927,"Obsessive master thief, Neil McCauley leads a top-notch crew on various insane heists throughout Los Angeles while a mentally unstable detective, Vincent Hanna pursues him without rest. Each man recognizes and respects the ability and the dedication of the other even though they are aware their cat-and-mouse game may end in violence.",1995-12-15,6.847732971901656
100,"Lock, Stock and Two Smoking Barrels",1998,1671,7,4.60786,A card sharp and his unwillingly-enlisted friends need to make a lot of cash quick after losing a sketchy poker match. To do this they decide to pull a heist on a small-time gang who happen to be operating out of the flat next door.,1998-03-05,6.8303203815920215
388,Inside Man,2006,1671,7,13.393548000000001,"Bank robber Dalton Russell enters a Manhattan bank, locks the doors and takes hostages, working methodically and without haste. Detective Frazier is assigned to negotiate, but his mind is occupied with the corruption charges he is facing. With an army of police surrounding the bank, the thief, the cop and a high-profile 'fixer' enter high-stakes negotiations.",2006-03-23,6.8303203815920215
2034,Training Day,2001,1665,7,13.664622,"On his first day on the job as a narcotics officer, a rookie cop works with a rogue detective who isn't what he appears.",2001-10-05,6.82977714606006
242,The Godfather: Part III,1990,1589,7,17.185349,"In the midst of trying to legitimize his business dealings in 1979 New York and Italy, aging mafia don, Michael Corleone seeks forgiveness for his sins while taking a young protege under his wing.",1990-12-24,6.822582364401956
9509,Man on Fire,2004,1583,7,9.635691,"Jaded ex-CIA operative John Creasy reluctantly accepts a job as the bodyguard for a 10-year-old girl in Mexico City. They clash at first, but eventually bond, and when she's kidnapped he's consumed by fury and will stop at nothing to save her life.",2004-04-23,6.821988365287183
184,Jackie Brown,1997,1580,7,16.415498,"Jackie Brown is a flight attendant who gets caught in the middle of smuggling cash into the country for her gunrunner boss. When the cops try to use Jackie to get to her boss, she hatches a plan—with help from a bail bondsman—to keep the money for herself. Based on Elmore Leonard's novel “Rum Punch”.",1997-12-24,6.821689871684735
235,Stand by Me,1986,1568,7,15.206957000000001,"After the death of a friend, a writer recounts a boyhood journey to find the body of a missing boy.",1986-08-22,6.820485819273625
4982,American Gangster,2007,1527,7,9.644542,"Following the death of his employer and mentor, Bumpy Johnson, Frank Lucas establishes himself as the number one importer of heroin in the Harlem district of Manhattan. He does so by buying heroin directly from the source in South East Asia and he comes up with a unique way of importing the drugs into the United States. Based on a true story.",2007-11-02,6.8162463852492134
22803,Law Abiding Citizen,2009,1522,7,16.639047,A frustrated man decides to take justice into his own hands after a plea bargain sets one of his family's killers free. He targets not only the killer but also the district attorney and others involved in the deal.,2009-10-15,6.815715642904026
4232,Scream,1996,1520,7,13.326443,"A killer known as Ghostface begins killing off teenagers, and as the body count begins rising, one girl and her friends find themselves contemplating the 'rules' of horror films as they find themselves living in a real-life one.",1996-12-20,6.815502486513885
23168,The Town,2010,1516,7,13.081203,"Doug MacRay is a longtime thief, who, smarter than the rest of his crew, is looking for his chance to exit the game. When a bank job leads to the group kidnapping an attractive branch manager, he takes on the role of monitoring her – but their burgeoning relationship threatens to unveil the identities of Doug and his crew to the FBI Agent who is on their case.",2010-09-15,6.815074690992498
