id,title,year,vote_count,vote_average,popularity,overview,release_date,wr
27205,Inception,2010,14075,8,29.108148999999997,"Cobb, a skilled thief who commits corporate espionage by infiltrating the subconscious of his targets is offered a chance to regain his old life as payment for a task considered to be impossible: ""inception"", the implantation of another person's idea into a target's subconscious.",2010-07-14,7.9564597231297585
155,The Dark Knight,2008,12269,8,123.167259,"Batman raises the stakes in his war on crime. With the help of Lt. Jim Gordon and District Attorney Harvey Dent, Batman sets out to dismantle the remaining criminal organizations that plague the streets. The partnership proves to be effective, but they soon find themselves prey to a reign of chaos unleashed by a rising criminal mastermind known to the terrified citizens of Gotham as the Joker.",2008-07-16,7.950164844127889
680,Pulp Fiction,1994,8670,8,140.95023600000002,"A burger-loving hit man, his philosophical partner, a drug-addled gangster's moll and a washed-up boxer converge in this sprawling, comedic crime caper. Their adventures unfurl in three stories that ingeniously trip back and forth in time.",1994-09-10,7.929995859906706
807,Se7en,1995,5915,8,18.45743,"Two homicide detectives are on a desperate hunt for a serial killer whose crimes are based on the ""seven deadly sins"" in this dark and haunting film that takes viewers from the tortured remains of one victim to the next. The seasoned Det. Sommerset researches each sin in an effort to get inside the killer's mind, while his novice partner, Mills, scoffs at his efforts to unravel the case.",1995-09-22,7.8985734368562115
205596,The Imitation Game,2014,5895,8,31.595940000000002,"Based on the real life story of legendary cryptanalyst Alan Turing, the film portrays the nail-biting race against time by Turing and his brilliant team of code-breakers at Britain's top-secret Government Code and Cypher School at Bletchley Park, during the darkest days of World War II.",2014-11-14,7.898241852884641
274,The Silence of the Lambs,1991,4549,8,4.307222,"FBI trainee, Clarice Starling ventures into a maximum-security asylum to pick the diseased brain of Hannibal Lecter, a psychiatrist turned homicidal cannibal. Starling needs clues to help her capture a serial killer. but her Faustian relationship with Lecter soon leads to his escape, and now two deranged killers are on the loose.",1991-02-01,7.8695379389719315
1124,The Prestige,2006,4510,8,16.94556,"A mysterious story of two magicians whose intense rivalry leads them on a life-long battle for supremacy -- full of obsession, deceit and jealousy with dangerous and deadly consequences.",2006-10-19,7.868462861240384
101,Leon: The Professional,1994,4293,8,20.477329,"Leon, the top hit man in New York, has earned a rep as an effective ""cleaner"". But when his next-door neighbors are wiped out by a loose-cannon DEA agent, he becomes the unwilling custodian of 12-year-old Mathilda. Before long, Mathilda's thoughts turn to revenge, and she considers following in Leon's footsteps.",1994-09-14,7.862141901231784
77,Memento,2000,4168,8,15.450789000000002,"Suffering short-term memory loss after a head injury, Leonard Shelby embarks on a grim quest to find the lowlife who murdered his wife in this gritty, complex thriller that packs more knots than a hangman's noose. To carry out his plan, Shelby snaps Polaroids of people and places, jotting down contextual notes on the backs of photos to aid in his search and jog his memory. He even tattoos his own body in a desperate bid to remember.",2000-10-11,7.858217182543186
694,The Shining,1980,3890,8,19.611589000000002,"Jack Torrance accepts a caretaker job at the Overlook Hotel, where he, along with his wife Wendy and their son Danny, must live isolated from the rest of the world for the winter. But they aren't prepared for the madness that lurks within.",1980-05-22,7.84863330254878
500,Reservoir Dogs,1992,3821,8,12.22034,"A botched robbery indicates a police informant, and the pressure mounts in the aftermath at a warehouse. Crime begets violence as the survivors -- veteran Mr. White, newcomer Mr. Orange, psychopathic parolee Mr. Blonde, bickering weasel Mr. Pink and Nice Guy Eddie -- unravel.",1992-09-02,7.846050444739315
629,The Usual Suspects,1995,3334,8,16.302466,"Held in an L.A. interrogation room, Verbal Kint attempts to convince the feds that a mythic crime lord, Keyser Soze, not only exists, but was also responsible for drawing him and his four partners into a multi-million dollar heist that ended with an explosion in San Pedro harbor – leaving few survivors. Verbal lures his interrogators with an incredible story of the crime lord's almost supernatural prowess.",1995-07-19,7.8249709515540715
111,Scarface,1983,3017,8,11.299673,"After getting a green card in exchange for assassinating a Cuban government official, Tony Montana stakes a claim on the drug trade in Miami. Viciously murdering anyone who stands in his way, Tony eventually becomes the biggest drug lord in the state, controlling nearly all the cocaine that comes through Miami. But increased pressure from the police, wars with Colombian drug cartels and his own drug-fueled paranoia serve to fuel the flames of his eventual downfall.",1983-12-08,7.807844610115865
264644,Room,2015,2838,8,12.443291,Jack is a young boy of 5 years old who has lived all his life in one room. He believes everything within it are the only real things in the world. But what will happen when his Ma suddenly tells him that there are other things outside of Room?,2015-10-16,7.796606718525947
539,Psycho,1960,2405,8,36.826309,"When larcenous real estate clerk Marion Crane goes on the lam with a wad of cash and hopes of starting a new life, she ends up at the notorious Bates Motel, where manager Norman Bates cares for his housebound mother. The place seems quirky, but fine… until Marion decides to take a shower.",1960-06-16,7.763090985802171
670,Oldboy,2003,2000,8,10.616859,"With no clue how he came to be imprisoned, drugged and tortured for 15 years, a desperate businessman seeks revenge on his captors.",2003-01-01,7.719923598952789
567,Rear Window,1954,1531,8,17.911314,"Professional photographer L.B. ""Jeff"" Jeffries breaks his leg while getting an action shot at an auto race. Confined to his New York apartment, he spends his time looking out of the rear window observing the neighbors. He begins to suspect that a man across the courtyard may have murdered his wife. Jeff enlists the help of his high society fashion-consultant girlfriend Lisa Freemont and his visiting nurse Stella to investigate.",1954-08-01,7.6450214879354315
426,Vertigo,1958,1162,8,18.20822,"A retired San Francisco detective suffering from acrophobia investigates the strange activities of an old friend's wife, all the while becoming dangerously obsessed with her.",1958-05-09,7.550425495336438
832,M,1931,465,8,12.752421,"In this classic German thriller, Hans Beckert, a serial killer who preys on children, becomes the focus of a massive Berlin police manhunt. Beckert's heinous crimes are so repellant and disruptive to city life that he is even targeted by others in the seedy underworld network. With both cops and criminals in pursuit, the murderer soon realizes that people are on his trail, sending him into a tense, panicked attempt to escape justice.",1931-05-11,7.09477124239111
290098,The Handmaiden,2016,453,8,16.727405,"1930s Korea, in the period of Japanese occupation, a new girl (Sookee) is hired as a handmaiden to a Japanese heiress (Hideko) who lives a secluded life on a large countryside estate with her domineering Uncle (Kouzuki). But the maid has a secret. She is a pickpocket recruited by a swindler posing as a Japanese Count to help him seduce the Lady to elope with him, rob her of her fortune, and lock her up in a madhouse. The plan seems to proceed according to plan until Sookee and Hideko discover some unexpected emotions.",2016-06-01,7.078694958402199
996,Double Indemnity,1944,425,8,6.49432,"Unsuspecting Mr. Dietrichson becomes increasingly accident prone after his icily calculating wife encourages him to sign a double indemnity policy proposed by a smooth-talking insurance agent. Against a backdrop of distinctly California settings, the partners in crime plan the perfect murder to collect the insurance. Perfect until a claims manager gets a familiar feeling of foul play and pursues the matter relentlessly.",1944-04-24,7.038867042446141
411088,The Invisible Guest,2016,395,8,13.90698,"""The Invisible Guest” turns on a young businessman who wakes up in a hotel room locked from the inside with the dead body of his lover next to him. He hires a prestigious lawyer, and over one night they work together to clarify what happened in a frenetic race against time.",2016-12-15,6.992187442759213
76341,Mad Max: Fury Road,2015,9629,7,29.36178,"An apocalyptic story set in the furthest reaches of our planet, in a stark desert landscape where humanity is broken, and most everyone is crazed fighting for the necessities of life. Within this world exist two rebels on the run who just might be able to restore order. There's Max, a man of action and a man of few words, who seeks peace of mind following the loss of his wife and child in the aftermath of the chaos. And Furiosa, a woman of action and a woman who believes her path to survival may be achieved if she can make it across the desert back to her childhood homeland.",2015-05-13,6.959415550959973
49026,The Dark Knight Rises,2012,9263,7,20.58258,"Following the death of District Attorney Harvey Dent, Batman assumes responsibility for Dent's crimes to protect the late attorney's reputation and is subsequently hunted by the Gotham City Police Department. Eight years later, Batman encounters the mysterious Selina Kyle and the villainous Bane, a new terrorist leader who overwhelms Gotham's finest. The Dark Knight resurfaces to protect a city that has branded him an enemy.",2012-07-16,6.957849624528749
597,Titanic,1997,7770,7,26.88907,"84 years later, a 101-year-old woman named Rose DeWitt Bukater tells the story to her granddaughter Lizzy Calvert, Brock Lovett, Lewis Bodine, Bobby Buell and Anatoly Mikailavich on the Keldysh about her life set in April 10th 1912, on a ship called Titanic when young Rose boards the departing ship with the upper-class passengers and her mother, Ruth DeWitt Bukater, and her fiancé, Caledon Hockley. Meanwhile, a drifter and artist named Jack Dawson and his best friend Fabrizio De Rossi win third-class tickets to the ship in a game. And she explains the whole story from departure until the death of Titanic on its first and last voyage April 15th, 1912 at 2:20 in the morning.",1997-11-18,6.9499761261391475
16869,Inglourious Basterds,2009,6598,7,16.89564,"In Nazi-occupied France during World War II, a group of Jewish-American soldiers known as ""The Basterds"" are chosen specifically to spread fear throughout the Third Reich by scalping and brutally killing Nazis. The Basterds, lead by Lt. Aldo Raine soon cross paths with a French-Jewish teenage girl who runs a movie theater in Paris which is targeted by the soldiers.",2009-08-18,6.941380530355002
11324,Shutter Island,2010,6559,7,15.813629,"World War II soldier-turned-U.S. Marshal Teddy Daniels investigates the disappearance of a patient from a hospital for the criminally insane, but his efforts are compromised by his troubling visions and also by a mysterious doctor.",2010-02-18,6.941043423240834
281957,The Revenant,2015,6558,7,23.501228,"In the 1820s, a frontiersman, Hugh Glass, sets out on a path of vengeance against those who left him for dead after a bear mauling.",2015-12-25,6.941034728478234
210577,Gone Girl,2014,6023,7,154.80100900000002,"With his wife's disappearance having become the focus of an intense media circus, a man sees the spotlight turned on him when it's suspected that he may not be innocent.",2014-10-01,6.935983826215214
49047,Gravity,2013,5879,7,18.50194,"Dr. Ryan Stone, a brilliant medical engineer on her first Shuttle mission, with veteran astronaut Matt Kowalsky in command of his last flight before retiring. But on a seemingly routine spacewalk, disaster strikes. The Shuttle is destroyed, leaving Stone and Kowalsky completely alone-tethered to nothing but each other and spiraling out into the blackness of space. The deafening silence tells them they have lost any link to Earth and any chance for rescue. As fear turns to panic, every gulp of air eats away at what little oxygen is left. But the only way home may be to go further out into the terrifying expanse of space.",2013-09-27,6.934473045772878
329865,Arrival,2016,5729,7,30.83786,"Taking place after alien crafts land around the world, an expert linguist is recruited by the military to determine whether they come in peace or are a threat.",2016-11-10,6.932821577598394
75656,Now You See Me,2013,5635,7,17.852022,An FBI agent and an Interpol detective track a team of illusionists who pull off bank heists during their performances and reward their audiences with the money.,2013-05-29,6.931743548387997
198663,The Maze Runner,2014,5540,7,76.93789,"Set in a post-apocalyptic world, young Thomas is deposited in a community of boys after his memory is erased, soon learning they're all trapped in a maze that will require him to join forces with fellow ""runners"" for a shot at escape.",2014-09-10,6.930618318391096
245891,John Wick,2014,5499,7,183.870374,Ex-lunatic John Wick comes off his meds to track down the bounders that killed his dog and made off with his self-respect,2014-10-22,6.930121149901668
348,Alien,1979,4564,7,23.37742,"During its return to the earth, commercial spaceship Nostromo intercepts a distress signal from a distant planet. When a three-member team of the crew discovers a chamber containing thousands of eggs on the planet, a creature inside one of the eggs attacks an explorer. The entire crew is unaware of the impending nightmare set to descend upon them when the alien parasite planted inside its unfortunate host is birthed.",1979-05-25,6.916471511352782
44214,Black Swan,2010,4562,7,12.989056,"A ballet dancer wins the lead in ""Swan Lake"" and is perfect for the role of the delicate White Swan - Princess Odette - but slowly loses her mind as she becomes more and more like Odile, the Black Swan.",2010-12-02,6.916436596524832
752,V for Vendetta,2006,4562,7,20.214422,"In a world in which Great Britain has become a fascist state, a masked vigilante known only as 'V' conducts guerrilla warfare against the oppressive British government. When 'V' rescues a young woman from the secret police, he finds in her an ally with whom he can continue his fight to free the people of Britain.",2006-03-15,6.916436596524832
119450,Dawn of the Planet of the Apes,2014,4511,7,75.385211,"A group of scientists in San Francisco struggle to stay alive in the aftermath of a plague that is wiping out humanity, while Caesar tries to maintain dominance over his community of intelligent apes.",2014-06-26,6.9155363000174
381288,Split,2016,4461,7,28.920839,"Though Kevin has evidenced 23 personalities to his trusted psychiatrist, Dr. Fletcher, there remains one still submerged who is set to materialize and dominate all the others. Compelled to abduct three teenage girls led by the willful, observant Casey, Kevin reaches a war for survival among all of those contained within him — as well as everyone around him — as the walls between his compartments shatter apart.",2016-11-15,6.914634622924689
1422,The Departed,2006,4455,7,18.515448000000003,"To take down South Boston's Irish Mafia, the police send in one of their own to infiltrate the underworld, not realizing the syndicate has done likewise. While an undercover cop curries favor with the mob kingpin, a career criminal rises through the police ranks. But both sides soon discover there's a mole among them.",2006-10-05,6.914525126321133
61791,Rise of the Planet of the Apes,2011,4452,7,41.613762,"Scientist Will Rodman is determined to find a cure for Alzheimer's, the disease which has slowly consumed his father. Will feels certain he is close to a breakthrough and tests his latest serum on apes, noticing dramatic increases in intelligence and brain activity in the primate subjects – especially Caesar, his pet chimpanzee.",2011-08-03,6.914470272614792
8681,Taken,2008,4444,7,16.367481,"While vacationing with a friend in Paris, an American girl is kidnapped by a gang of human traffickers intent on selling her into forced prostitution. Working against the clock, her ex-spy father must pull out all the stops to save her. But with his best years possibly behind him, the job may be more than he can handle.",2008-02-18,6.914323651272284
280,Terminator 2: Judgment Day,1991,4274,7,22.661695,"Nearly 10 years have passed since Sarah Connor was targeted for termination by a cyborg from the future. Now her son, John, the future leader of the resistance, is the target for a newer, more deadly terminator. Once again, the resistance has managed to send a protector back to attempt to save John and his mother Sarah.",1991-07-01,6.9110846139151745
218,The Terminator,1984,4208,7,19.293561999999998,"In the post-apocalyptic future, reigning tyrannical supercomputers teleport a cyborg assassin known as the ""Terminator"" back to 1984 to kill Sarah Connor, whose unborn son is destined to lead insurgents against 21st century mechanical hegemony. Meanwhile, the human-resistance movement dispatches a lone warrior to safeguard Sarah. Can he stop the virtually indestructible killing machine?",1984-10-26,6.9097601244481375
393,Kill Bill: Vol. 2,2004,4061,7,21.533072,"The Bride unwaveringly continues on her roaring rampage of revenge against the band of assassins who had tried to kill her and her unborn child. She visits each of her former associates one-by-one, checking off the victims on her Death List Five until there's nothing left to do … but kill Bill.",2004-04-16,6.906663441275618
562,Die Hard,1988,4005,7,16.640522,"NYPD cop, John McClane's plan to reconcile with his estranged wife is thrown for a serious loop when minutes after he arrives at her office, the entire building is overtaken by a group of terrorists. With little help from the LAPD, wisecracking McClane sets out to single-handedly rescue the hostages and bring the bad guys down.",1988-07-15,6.9054271077399925
18,The Fifth Element,1997,3962,7,24.30526,"In 2257, a taxi driver is unintentionally given the task of saving a young girl who is part of the key that will ensure the survival of humanity.",1997-05-07,6.904455321383222
36557,Casino Royale,2006,3930,7,23.065078,"Le Chiffre, a banker to the world's terrorists, is scheduled to participate in a high-stakes poker game in Montenegro, where he intends to use his winnings to establish his financial grip on the terrorist market. M sends Bond – on his maiden mission as a 00 Agent – to attend this game and prevent Le Chiffre from winning. With the help of Vesper Lynd and Felix Leiter, Bond enters the most important poker game in his already dangerous career.",2006-11-14,6.90371907033794
51876,Limitless,2011,3888,7,12.114955,"A paranoia-fueled action thriller about an unsuccessful writer whose life is transformed by a top-secret ""smart drug"" that allows him to use 100% of his brain and become a perfect version of himself. His enhanced abilities soon attract shadowy forces that threaten his new life in this darkly comic and provocative film.",2011-03-08,6.902735345170497
161,Ocean's Eleven,2001,3857,7,12.114932000000001,"Less than 24 hours into his parole, charismatic thief Danny Ocean is already rolling out his next plan: In one night, Danny's hand-picked crew of specialists will attempt to steal more than $150 million from three Las Vegas casinos. But to score the cash, Danny risks his chances of reconciling with ex-wife, Tess.",2001-12-07,6.901996270165053
78,Blade Runner,1982,3833,7,96.272374,"In the smog-choked dystopian Los Angeles of 2019, blade runner Rick Deckard is called out of retirement to terminate a quartet of replicants who have escaped to Earth seeking their creator for a way to extend their short life spans.",1982-06-25,6.901416323542758
64690,Drive,2011,3832,7,15.388875,A Hollywood stunt performer who moonlights as a wheelman for criminals discovers that a contract has been put on him after a heist gone wrong.,2011-08-06,6.90139201010984
2501,The Bourne Identity,2002,3640,7,21.040126,"Wounded to the brink of death and suffering from amnesia, Jason Bourne is rescued at sea by a fisherman. With nothing to go on but a Swiss bank account number, he starts to reconstruct his life, but finds that many people he encounters want him dead. However, Bourne realizes that he has the combat and mental skills of a world-class spy – but who does he work for?",2002-06-14,6.8964905851845515
242582,Nightcrawler,2014,3475,7,21.277073,"When Lou Bloom, desperate for work, muscles into the world of L.A. crime journalism, he blurs the line between observer and participant to become the star of his own story. Aiding him in his effort is Nina, a TV-news veteran.",2014-10-23,6.891871753628571
68734,Argo,2012,3473,7,14.238234,"As the Iranian revolution reaches a boiling point, a CIA 'exfiltration' specialist concocts a risky plan to free six Americans who have found shelter at the home of the Canadian ambassador.",2012-10-11,6.891813237923091
4922,The Curious Case of Benjamin Button,2008,3398,7,17.934821,"Tells the story of Benjamin Button, a man who starts aging backwards with bizarre consequences.",2008-11-24,6.889572232825798
679,Aliens,1986,3282,7,21.761179000000002,"When Ripley's lifepod is found by a salvage crew over 50 years later, she finds that terra-formers are on the very planet they found the alien species. When the company sends a family of colonists out to investigate her story, all contact is lost with the planet and colonists. They enlist Ripley and the colonial marines to return and search for answers.",1986-07-18,6.88591724923456
177677,Mission: Impossible - Rogue Nation,2015,3274,7,17.836882,"Ethan and team take on their most impossible mission yet, eradicating the Syndicate - an International rogue organization as highly skilled as they are, committed to destroying the IMF.",2015-07-23,6.885656242569384
745,The Sixth Sense,1999,3223,7,18.449169,"A psychological thriller about an eight year old boy named Cole Sear who believes he can see into the world of the dead. A child psychologist named Malcolm Crowe comes to Cole to help him deal with his problem, learning that he really can see ghosts of dead people.",1999-08-06,6.8839638341679095
146233,Prisoners,2013,3183,7,11.96262,"When Keller Dover's daughter and her friend go missing, he takes matters into his own hands as the police pursue multiple leads and the pressure mounts. But just how far will this desperate father go to protect his family?",2013-09-18,6.882600987577405
138843,The Conjuring,2013,3169,7,14.901689999999999,"Paranormal investigators Ed and Lorraine Warren work to help a family terrorized by a dark presence in their farmhouse. Forced to confront a powerful entity, the Warrens find themselves caught in the most terrifying case of their lives.",2013-07-18,6.882116396907853
11878,Yojimbo,1961,334,8,10.313688,"A nameless ronin, or samurai with no master, enters a small village in feudal Japan where two rival businessmen are struggling for control of the local gambling trade. Taking the name Sanjuro Kuwabatake, the ronin convinces both silk merchant Tazaemon and sake merchant Tokuemon to hire him as a personal bodyguard, then artfully sets in motion a full-scale gang war between the two ambitious and unscrupulous men.",1961-04-25,6.881757110458714
6977,No Country for Old Men,2007,3083,7,15.565484,"Llewelyn Moss stumbles upon dead bodies, $2 million and a hoard of heroin in a Texas desert, but methodical killer Anton Chigurh comes looking for it, with local sheriff Ed Tom Bell hot on his trail. The roles of prey and predator blur as the violent pursuit of money and justice collide.",2007-11-08,6.879049576002773
156022,The Equalizer,2014,2997,7,17.618057,"In The Equalizer, Denzel Washington plays McCall, a man who believes he has put his mysterious past behind him and dedicated himself to beginning a new, quiet life. But when McCall meets Teri (Chloë Grace Moretz), a young girl under the control of ultra-violent Russian gangsters, he can’t stand idly by – he has to help her. Armed with hidden skills that allow him to serve vengeance against anyone who would brutalize the helpless, McCall comes out of his self-imposed retirement and finds his desire for justice reawakened. If someone has a problem, if the odds are stacked against them, if they have nowhere else to turn, McCall will help. He is The Equalizer.",2014-09-24,6.8758189220711134
419430,Get Out,2017,2978,7,36.894806,"Chris and his girlfriend Rose go upstate to visit her parents for the weekend. At first, Chris reads the family's overly accommodating behavior as nervous attempts to deal with their daughter's interracial relationship, but as the weekend progresses, a series of increasingly disturbing discoveries lead him to a truth that he never could have imagined.",2017-02-24,6.875081758175513
107,Snatch,2000,2953,7,14.014025,"The second film from British director Guy Ritchie. Snatch tells an obscure story similar to his first fast-paced crazy character-colliding filled film “Lock, Stock and Two Smoking Barrels.” There are two overlapping stories here – one is the search for a stolen diamond, and the other about a boxing promoter who’s having trouble with a psychotic gangster.",2000-09-01,6.874098366782872
