id,title,year,vote_count,vote_average,popularity,overview,release_date,wr
1538,Collateral,2004,1476,7,13.455112,Cab driver Max picks up a man who offers him $600 to drive him around. But the promise of easy money sours when Max realizes his fare is an assassin.,2004-08-04,6.8106850331915965
322,Mystic River,2003,1473,7,12.602438000000001,"A story about friendship and loyalty, guilt and vengeance, and the fateful affect the past has on the present.",2003-10-07,6.810347392801354
856,Who Framed Roger Rabbit,1988,1466,7,16.78596,"'Toon star Roger is worried that his wife Jessica is playing pattycake with someone else, so the studio hires detective Eddie Valiant to snoop on her. But the stakes are quickly raised when Marvin Acme is found dead and Roger is the prime suspect.",1988-06-21,6.809554862056689
117,The Untouchables,1987,1424,7,11.062203,"Young Treasury Agent Elliot Ness arrives in Chicago and is determined to take down Al Capone, but it's not going to be easy because Capone has the police in his pocket. Ness meets Jimmy Malone, a veteran patrolman and probably the most honorable one on the force. He asks Malone to help him get Capone, but Malone warns him that if he goes after Capone, he is going to war.",1987-06-02,6.804657001672377
8321,In Bruges,2008,1414,7,9.895652,"Ray and Ken, two hit men, are in Bruges, Belgium, waiting for their next mission. While they are there they have time to think and discuss their previous assignment. When the mission is revealed to Ken, it is not what he expected.",2008-02-08,6.80345348372322
941,Lethal Weapon,1987,1367,7,13.183804,"Veteran buttoned-down LAPD detective Roger Murtaugh is partnered with unhinged cop Martin Riggs, who -- distraught after his wife's death -- has a death wish and takes unnecessary risks with criminals at every turn. The odd couple embark on their first homicide investigation as partners, involving a young woman known to Murtaugh with ties to a drug and prostitution ring.",1987-03-06,6.797592379564215
1830,Lord of War,2005,1356,7,8.745216000000001,"Yuri Orlov is a globetrotting arms dealer and, through some of the deadliest war zones, he struggles to stay one step ahead of a relentless Interpol agent, his business rivals and even some of his customers who include many of the world's most notorious dictators. Finally, he must also face his own conscience.",2005-09-16,6.796169797093578
186,Lucky Number Slevin,2006,1356,7,11.15092,"Slevin is mistakenly put in the middle of a personal war between the city’s biggest criminal bosses. Under constant watch, Slevin must try not to get killed by an infamous assassin and come up with an idea of how to get out of his current dilemma. A film with many twists and turns.",2006-02-24,6.796169797093578
4133,Blow,2001,1352,7,12.332222999999999,"A boy named George Jung grows up in a struggling family in the 1950's. His mother nags at her husband as he is trying to make a living for the family. It is finally revealed that George's father cannot make a living and the family goes bankrupt. George does not want the same thing to happen to him, and his friend Tuna, in the 1960's, suggests that he deal marijuana. He is a big hit in California in the 1960's, yet he goes to jail, where he finds out about the wonders of cocaine. As a result, when released, he gets rich by bringing cocaine to America. However, he soon pays the price.",2001-04-04,6.795647523817283
524,Casino,1995,1343,7,10.137389,The life of the gambling paradise – Las Vegas – and its dark mafia underbelly.,1995-11-22,6.794462566478423
2118,L.A. Confidential,1997,1340,7,10.989442,Three detectives in the corrupt and brutal L.A. police force of the 1950s use differing methods to uncover a conspiracy behind the shotgun slayings of the patrons at an all-night diner.,1997-09-19,6.794064520967761
338766,Hell or High Water,2016,1304,7,12.565896,A divorced dad and his ex-con brother resort to a desperate scheme in order to save their family's farm in West Texas.,2016-08-12,6.789164859844794
5503,The Fugitive,1993,1240,7,10.089369999999999,"Wrongfully accused of murdering his wife, Richard Kimble escapes from the law in an attempt to find her killer and clear his name. Pursuing him is a team of U.S. marshals led by Deputy Samuel Gerard, a determined detective who will not rest until Richard is captured. As Richard leads the team through a series of intricate chases, he discovers the secrets behind his wife's death and struggles to expose the killer before it is too late.",1993-08-06,6.779853253351155
1427,Perfume: The Story of a Murderer,2006,1198,7,10.297303999999999,"Jean-Baptiste Grenouille, born in the stench of 18th century Paris, develops a superior olfactory sense, which he uses to create the world's finest perfumes. However, his work takes a dark turn as he tries to preserve scents in the search for the ultimate perfume.",2006-09-13,6.773282175702622
77016,End of Watch,2012,1186,7,7.452789999999999,Two young officers are marked for death after confiscating a small cache of money and firearms from the members of a notorious cartel during a routine traffic stop.,2012-09-20,6.771332054642075
9366,Donnie Brasco,1997,1175,7,12.201953999999999,An FBI undercover agent infilitrates the mob and finds himself identifying more with the mafia life at the expense of his regular one.,1997-02-27,6.769514738408466
3580,Changeling,2008,1151,7,11.672394,"Christine Collins is overjoyed when her kidnapped son is brought back home. But when Christine suspects that the boy returned to her isn't her child, the police captain has her committed to an asylum.",2008-01-30,6.765447650489787
116,Match Point,2005,1134,7,9.020372,"Match Point is Woody Allen’s satire of the British High Society and the ambition of a young tennis instructor to enter into it. Yet when he must decide between two women - one assuring him his place in high society, and the other that would bring him far from it - palms start to sweat and a dark psychological match in his head begins.",2005-10-26,6.762478854464417
4147,Road to Perdition,2002,1102,7,13.426684,"Mike Sullivan works as a hit man for crime boss John Rooney. Sullivan views Rooney as a father figure, however after his son is witness to a killing, Mike Sullivan finds himself on the run in attempt to save the life of his son and at the same time looking for revenge on those who wronged him.",2002-07-12,6.756681679071892
525,The Blues Brothers,1980,1092,7,10.076901,"Jake Blues is just out of jail, and teams up with his brother, Elwood on a 'mission from God' to raise funds for the orphanage in which they grew up. The only thing they can do is do what they do best – play music – so they get their old band together and they're on their way, while getting in a bit of trouble here and there.",1980-06-17,6.754811582069909
94329,The Raid,2011,1076,7,10.528833,"Deep in the heart of Jakarta's slums lies an impenetrable safe house for the world's most dangerous killers and gangsters. Until now, the run-down apartment block has been considered untouchable to even the bravest of police. Cloaked under the cover of pre-dawn darkness and silence, an elite swat team is tasked with raiding the safe house in order to take down the notorious drug lord that runs it.  But when a chance encounter with a spotter blows their cover and news of their assault reaches the drug lord, the building's lights are cut and all the exits blocked. Stranded on the sixth floor with no way out, the unit must fight their way through the city's worst to survive their mission. Starring Indonesian martial arts sensation Iko Uwais.",2011-09-08,6.751758889916084
1542,Office Space,1999,1068,7,12.329066000000001,Three office workers strike back at their evil employers by hatching a hapless attempt to embezzle money.,1999-02-19,6.750203859863095
4771,Gone Baby Gone,2007,1034,7,6.148516000000001,"When 4 year old Amanda McCready disappears from her home and the police make little headway in solving the case, the girl's aunt, Beatrice McCready hires two private detectives, Patrick Kenzie and Angie Gennaro. The detectives freely admit that they have little experience with this type of case, but the family wants them for two reasons - they're not cops and they know the tough neighborhood in which they all live. As the case progresses, Kenzie and Gennaro face drug dealers, gangs and pedophiles. When they are about to solve the case, they are faced with a moral dilemma that tears them apart.",2007-10-19,6.743371691280797
37136,The Naked Gun: From the Files of Police Squad!,1988,1020,7,15.698222,"When the incompetent Officer Frank Drebin seeks the ruthless killer of his partner, he stumbles upon an attempt to assassinate Queen Elizabeth.",1988-12-02,6.740448579799169
15472,The Girl with the Dragon Tattoo,2009,1020,7,9.858687,"Swedish thriller based on Stieg Larsson's novel about a male journalist and a young female hacker. In the opening of the movie, Mikael Blomkvist, a middle-aged publisher for the magazine Millennium, loses a libel case brought by corrupt Swedish industrialist Hans-Erik Wennerström. Nevertheless, he is hired by Henrik Vanger in order to solve a cold case, the disappearance of Vanger's niece",2009-02-27,6.740448579799169
470,21 Grams,2003,943,7,6.372278,"This is the story of three gentle persons: Paul Rivers an ailing mathematician lovelessly married to an English émigré, Christina Peck, an upper-middle-class suburban housewife, happily married and mother of two little girls, and Jack Jordan, an ex-convict who has found in his Christian faith the strength to raise a family. They will be brought together by a terrible accident that will change their lives. By the final frame, none of them will be the same as they will learn harsh truths about love, faith, courage, desire and guilt, and how chance can change our worlds irretrievably, forever.",2003-09-06,6.723101596589844
829,Chinatown,1974,939,7,12.29227,"Private eye Jake Gittes lives off the murky moral climate of sunbaked, pre-World War II Southern California. Hired by a beautiful socialite to investigate her husband's extra-marital affair, Gittes is swept into a maelstrom of double dealings and deadly deceits, uncovering a web of personal and political scandals that come crashing together.",1974-06-20,6.722136877825241
50348,The Lincoln Lawyer,2011,923,7,6.807442,A lawyer conducts business from the back of his Lincoln town car while representing a high-profile client in Beverly Hills.,2011-03-17,6.718209830784523
5236,Kiss Kiss Bang Bang,2005,900,7,11.760539999999999,A petty thief posing as an actor is brought to Los Angeles for an unlikely audition and finds himself in the middle of a murder investigation along with his high school dream girl and a detective who's been training him for his upcoming role...,2005-09-05,6.712366197305165
2252,Eastern Promises,2007,867,7,9.897909,A Russian teenager living in London who dies during childbirth leaves clues to a midwife in her journal that could tie her child to a rape involving a violent Russian mob family.,2007-09-14,6.703545534272984
