id,title,year,vote_count,vote_average,popularity,overview,release_date,wr
2503,The Bourne Ultimatum,2007,2938,7,18.173269,"Bourne is brought out of hiding once again by reporter Simon Ross who is trying to unveil Operation Blackbriar, an upgrade to Project Treadstone, in a series of newspaper columns. Information from the reporter stirs a new set of memories, and Bourne must finally uncover his dark past while dodging The Company's best efforts to eradicate him.",2007-08-03,6.873500864806013
2502,The Bourne Supremacy,2004,2873,7,20.40426,"When a CIA operation to purchase classified Russian documents is blown by a rival agent, who then shows up in the sleepy seaside village where Bourne and Marie have been living. The pair run for their lives and Bourne, who promised retaliation should anyone from his former life attempt contact, is forced to once again take up his life as a trained assassin to survive.",2004-07-23,6.870844779336617
187,Sin City,2005,2755,7,15.010525,"Welcome to Sin City. This town beckons to the tough, the corrupt, the brokenhearted. Some call it dark… Hard-boiled. Then there are those who call it home — Crooked cops, sexy dames, desperate vigilantes. Some are seeking revenge, others lust after redemption, and then there are those hoping for a little of both. A universe of unlikely and reluctant heroes still trying to do the right thing in a city that refuses to care.",2005-04-01,6.865726629073569
45612,Source Code,2011,2752,7,9.796961999999999,"Decorated soldier Captain Colter Stevens wakes up in the body of an unknown man, discovering he's involved in a mission to find the bomber of a Chicago commuter train. He learns he's part of a top-secret experimental program that enables him to experience the final 8 minutes of another person's life. Colter re-lives the train incident over and over again, gathering more clues each time. But can he discover who is responsible for the attack before the next one happens?",2011-03-30,6.8655912136996555
314365,Spotlight,2015,2751,7,14.63239,"The true story of how The Boston Globe uncovered the massive scandal of child abuse and the cover-up within the local Catholic Archdiocese, shaking the entire Catholic Church to its core.",2015-11-06,6.8655460145247895
374720,Dunkirk,2017,2712,7,30.938854,"The miraculous evacuation of Allied soldiers from Belgium, Britain, Canada and France, who were cut off and surrounded by the German army from the beaches and harbor of Dunkirk, France, between May 26th and June 4th 1940, during the Battle of France in World War II.",2017-07-19,6.8637592201561874
44115,127 Hours,2010,2668,7,11.176797,The true story of mountain climber Aron Ralston's remarkable adventure to save himself after a fallen boulder crashes on his arm and traps him in an isolated canyon in Utah.,2010-11-05,6.861685468361423
180,Minority Report,2002,2663,7,20.666063,"John Anderton is a top 'Precrime' cop in the late-21st century, when technology can predict crimes before they're committed. But Anderton becomes the quarry when another investigator targets him for a murder charge.",2002-06-20,6.861445813283559
296098,Bridge of Spies,2015,2633,7,13.707888,"During the Cold War, the Soviet Union captures U.S. pilot Francis Gary Powers after shooting down his U-2 spy plane. Sentenced to 10 years in prison, Powers' only hope is New York lawyer James Donovan, recruited by a CIA operative to negotiate his release. Donovan boards a plane to Berlin, hoping to win the young man's freedom through a prisoner exchange. If all goes well, the Russians would get Rudolf Abel, the convicted spy who Donovan defended in court.",2015-10-15,6.859990259268258
578,Jaws,1975,2628,7,19.726114000000003,"An insatiable great white shark terrorizes the townspeople of Amity Island, The police chief, an oceanographer and a grizzled shark hunter seek to destroy the bloodthirsty beast.",1975-06-18,6.859744688459806
109424,Captain Phillips,2013,2495,7,13.776067999999999,"The true story of Captain Richard Phillips and the 2009 hijacking by Somali pirates of the US-flagged MV Maersk Alabama, the first American cargo ship to be hijacked in two hundred years.",2013-10-10,6.852880812228121
51497,Fast Five,2011,2491,7,1.420361,"Former cop Brian O'Conner partners with ex-con Dom Toretto on the opposite side of the law. Since Brian and Mia Toretto broke Dom out of custody, they've blown across many borders to elude authorities. Now backed into a corner in Rio de Janeiro, they must pull one last job in order to gain their freedom.",2011-04-20,6.852663958209222
65754,The Girl with the Dragon Tattoo,2011,2479,7,8.907829,"This English-language adaptation of the Swedish novel by Stieg Larsson follows a disgraced journalist, Mikael Blomkvist, as he investigates the disappearance of a weary patriarch's niece from 40 years ago. He is aided by the pierced, tattooed, punk computer hacker named Lisbeth Salander. As they work together in the investigation, Blomkvist and Salander uncover immense corruption beyond anything they have ever imagined.",2011-12-14,6.852009543395775
63,Twelve Monkeys,1995,2470,7,12.297305,"In the year 2035, convict James Cole reluctantly volunteers to be sent back in time to discover the origin of a deadly virus that wiped out nearly all of the earth's population and forced the survivors into underground communities. But when Cole is mistakenly sent to 1990 instead of 1996, he's arrested and locked up in a mental hospital. There he meets psychiatrist Dr. Kathryn Railly, and patient Jeffrey Goines, the son of a famous virus expert, who may hold the key to the mysterious rogue group, the Army of the 12 Monkeys, thought to be responsible for unleashing the killer disease.",1995-12-29,6.851514904516792
273481,Sicario,2015,2465,7,19.511221,"A young female FBI agent joins a secret CIA operation to take down a Mexican cartel boss, a job that ends up pushing her ethical and moral values to the limit.",2015-09-17,6.851238673733068
290250,The Nice Guys,2016,2382,7,16.075615,A private eye investigates the apparent suicide of a fading porn star in 1970s Los Angeles and uncovers a conspiracy.,2016-05-15,6.846498323566002
1372,Blood Diamond,2006,2344,7,12.477872,"An ex-mercenary turned smuggler. A Mende fisherman. Amid the explosive civil war overtaking 1999 Sierra Leone, these men join for two desperate missions: recovering a rare pink diamond of immense value and rescuing the fisherman's son conscripted as a child soldier into the brutal rebel forces ripping a swath of torture and bloodshed countrywide.",2006-12-07,6.844225730857664
106,Predator,1987,2129,7,18.495694,"Dutch and his group of commandos are hired by the CIA to rescue downed airmen from guerillas in a Central American jungle. The mission goes well but as they return they find that something is hunting them. Nearly invisible, it blends in with the forest, taking trophies from the bodies of its victims as it goes along. Occasionally seeing through its eyes, the audience sees it is an intelligent alien hunter, hunting them for sport, killing them off one at a time.",1987-06-11,6.829984344683576
1359,American Psycho,2000,2128,7,13.686715,"A wealthy New York investment banking executive hides his alternate psychopathic ego from his co-workers and friends as he escalates deeper into his illogical, gratuitous fantasies.",2000-04-13,6.829912019139987
9693,Children of Men,2006,2120,7,14.114606,"In 2027, in a chaotic world in which humans can no longer procreate, a former activist agrees to help transport a miraculously pregnant woman to a sanctuary at sea, where her child's birth may help scientists save the future of humankind.",2006-09-22,6.829331191954738
1954,The Butterfly Effect,2004,2119,7,12.994939,"A young man struggles to access sublimated childhood memories. He finds a technique that allows him to travel back into the past, to occupy his childhood body and change history. However, he soon finds that every change he makes has unexpected consequences.",2004-01-22,6.829258309515466
275,Fargo,1996,2080,7,12.61469,"Jerry, a small-town Minnesota car salesman is bursting at the seams with debt... but he's got a plan. He's going to hire two thugs to kidnap his wife in a scheme to collect a hefty ransom from his wealthy father-in-law. It's going to be a snap and nobody's going to get hurt... until people start dying. Enter Police Chief Marge, a coffee-drinking, parka-wearing - and extremely pregnant - investigator who'll stop at nothing to get her man. And if you think her small-time investigative skills will give the crooks a run for their ransom... you betcha!",1996-04-05,6.8263665190395475
1949,Zodiac,2007,2080,7,19.083823000000002,"The true story of the investigation of 'The Zodiac Killer',  a serial killer who terrified the San Francisco Bay Area, taunting police with his ciphers and letters. The case becomes an obsession for four men as their lives and careers are built and destroyed by the endless trail of clues.",2007-03-02,6.8263665190395475
80278,The Impossible,2012,2071,7,10.027434,"In December 2004, close-knit family Maria, Henry and their three sons begin their winter vacation in Thailand. But the day after Christmas, the idyllic holiday turns into an incomprehensible nightmare when a terrifying roar rises from the depths of the sea, followed by a wall of black water that devours everything in its path. Though Maria and her family face their darkest hour, unexpected displays of kindness and courage ameliorate their terror.",2012-09-09,6.8256852175055
9552,The Exorcist,1973,2046,7,12.137595,"12-year-old Regan MacNeil begins to adapt an explicit new personality as strange events befall the local area of Georgetown. Her mother becomes torn between science and superstition in a desperate bid to save her daughter, and ultimately turns to her last hope: Father Damien Karras, a troubled priest who is struggling with his own faith.",1973-12-26,6.82376435112283
340666,Nocturnal Animals,2016,1990,7,18.908782,"Susan Morrow receives a book manuscript from her ex-husband – a man she left 20 years earlier – asking for her opinion of his writing. As she reads, she is drawn into the fictional life of Tony Hastings, a mathematics professor whose family vacation turns violent.",2016-11-04,6.819304100597626
206487,Predestination,2014,1971,7,10.524204,"Predestination chronicles the life of a Temporal Agent sent on an intricate series of time-travel journeys designed to prevent future killers from committing their crimes. Now, on his final assignment, the Agent must stop the one criminal that has eluded him throughout time and prevent a devastating attack in which thousands of lives will be lost.",2014-08-28,6.817739063405373
949,Heat,1995,1886,7,17.924927,"Obsessive master thief, Neil McCauley leads a top-notch crew on various insane heists throughout Los Angeles while a mentally unstable detective, Vincent Hanna pursues him without rest. Each man recognizes and respects the ability and the dedication of the other even though they are aware their cat-and-mouse game may end in violence.",1995-12-15,6.810392271727777
12162,The Hurt Locker,2008,1881,7,9.403724,"Forced to play a dangerous game of cat-and-mouse in the chaos of war, an elite Army bomb squad unit must come together in a city where everyone is a potential enemy and every object could be a deadly bomb.",2008-10-10,6.809941618763306
782,Gattaca,1997,1846,7,12.89312,"Science fiction drama about a future society in the era of indefinite eugenics where humans are set on a life course depending on their DNA. The young Vincent Freeman is born with a condition that would prevent him from space travel, yet he is determined to infiltrate the GATTACA space program.",1997-09-07,6.806726051816293
170,28 Days Later,2002,1816,7,17.656951,"Twenty-eight days after a killer virus was accidentally unleashed from a British research facility, a small group of London survivors are caught in a desperate struggle to protect themselves from the infected. Carried by animals and humans, the virus turns those it infects into homicidal maniacs -- and it's absolutely impossible to contain.",2002-10-31,6.803881975470823
1933,The Others,2001,1708,7,11.046007000000001,"Grace is a religious woman who lives in an old house kept dark because her two children, Anne and Nicholas, have a rare sensitivity to light. When the family begins to suspect the house is haunted, Grace fights to protect her children at any cost in the face of strange events and disturbing visions.",2001-08-02,6.792911474279984
388,Inside Man,2006,1671,7,13.393548000000001,"Bank robber Dalton Russell enters a Manhattan bank, locks the doors and takes hostages, working methodically and without haste. Detective Frazier is assigned to negotiate, but his mind is occupied with the corruption charges he is facing. With an army of police surrounding the bank, the thief, the cop and a high-profile 'fixer' enter high-stakes negotiations.",2006-03-23,6.788865281402738
2034,Training Day,2001,1665,7,13.664622,"On his first day on the job as a narcotics officer, a rookie cop works with a rogue detective who isn't what he appears.",2001-10-05,6.788194195789779
