id,title,year,vote_count,vote_average,popularity,overview,release_date,wr
152584,Blue Is the Warmest Color,2013,1114,7,4.938148,"Adele's life is changed when she meets Emma, a young woman with blue hair, who will allow her to discover desire, to assert herself as a woman and as an adult. In front of others, Adele grows, seeks herself, loses herself, finds herself.",2013-10-09,6.879606528723378
6114,Dracula,1992,1087,7,16.777675,"When Dracula leaves the captive Jonathan Harker and Transylvania for London in search of Mina Harker -- the spitting image of Dracula's long-dead wife, Elisabeta -- obsessed vampire hunter Dr. Van Helsing sets out to end the madness.",1992-11-13,6.876846851565327
228205,The Longest Ride,2015,1083,7,10.264416,The lives of a young couple intertwine with a much older man as he reflects back on a lost love while he's trapped in an automobile crash.,2015-04-09,6.876427213952464
164,Breakfast at Tiffany's,1961,1082,7,10.879289,"Fortune hunter Holly Golightly finds herself captivated by aspiring writer Paul Varjak, who's moved into her building on a wealthy woman's dime. As romance blooms between Paul and Holly, Doc Golightly shows up on the scene, revealing Holly's past.",1961-10-05,6.876321857326966
74643,The Artist,2011,1075,7,11.440947999999999,"Hollywood, 1927: As silent movie star George Valentin wonders if the arrival of talking pictures will cause him to fade into oblivion, he sparks with Peppy Miller, a young dancer set for a big break.",2011-05-15,6.875579300505016
4347,Atonement,2007,1075,7,8.913338000000001,"As a 13-year-old, fledgling writer Briony Tallis irrevocably changes the course of several lives when she accuses her older sister's lover of a crime he did not commit.",2007-08-29,6.875579300505016
10229,A Walk to Remember,2002,1057,7,8.054499,"When the popular, restless Landon Carter is forced to participate in the school drama production he falls in love with Jamie Sullivan, the daughter of the town's minister. Jamie has a ""to-do"" list for her life and also a very big secret she must keep from Landon.",2002-01-25,6.873628283351162
703,Annie Hall,1977,1044,7,18.146043,"In the city of New York, comedian Alvy Singer falls in love with the ditsy Annie Hall.",1977-04-19,6.872180726459422
12163,The Wrestler,2008,1031,7,7.903956,"Aging wrestler Randy ""The Ram"" Robinson is long past his prime but still ready and rarin' to go on the pro-wrestling circuit. After a particularly brutal beating, however, Randy hangs up his tights, pursues a serious relationship with a long-in-the-tooth stripper, and tries to reconnect with his estranged daughter. But he can't resist the lure of the ring and readies himself for a comeback.",2008-09-07,6.87069962247865
258480,Carol,2015,1014,7,8.364201,"In 1950s New York, a department-store clerk who dreams of a better life falls for an older, married woman.",2015-11-20,6.868710205863696
6023,P.S. I Love You,2007,1011,7,10.304881,A young widow discovers that her late husband has left her 10 messages intended to help ease her pain and start a new life.,2007-11-15,6.8683527601949335
51828,One Day,2011,1006,7,11.239011999999999,"A romantic comedy centered on Dexter and Emma, who first meet during their graduation in 1988 and proceed to keep in touch regularly. The film follows what they do on July 15 annually, usually doing something together.",2011-03-02,6.867752672494118
770,Gone with the Wind,1939,995,7,14.240357000000001,An American classic in which a manipulative woman and a roguish man carry on a turbulent love affair in the American south during the Civil War and Reconstruction.,1939-12-15,6.8664130274047315
76,Before Sunrise,1995,984,7,11.304979,"A dialogue marathon of a film, this fairytale love story of an American boy and French girl. During a day and a night together in Vienna their two hearts collide.",1995-01-27,6.865045963772256
639,When Harry Met Sally...,1989,974,7,8.34322,"During their travels from Chicago to New York, Harry and Sally Will debate whether or not sex ruins a perfect relationship between a man and a woman. Eleven years and later, they're still no closer to finding the answer.",1989-07-21,6.863778670728517
15121,The Sound of Music,1965,966,7,9.067730000000001,Film adaptation of a classic Rodgers and Hammerstein musical based on a nun who becomes a governess for an Austrian family.,1965-03-02,6.862747569740559
35690,The Last Song,2010,959,7,5.541073,"A drama centered on a rebellious girl who is sent to a Southern beach town for the summer to stay with her father. Through their mutual love of music, the estranged duo learn to reconnect.",2010-03-31,6.86183246638613
146,"Crouching Tiger, Hidden Dragon",2000,949,7,19.944952999999998,"Two warriors in pursuit of a stolen sword and a notorious fugitive are led to an impetuous, physically-skilled, teenage nobleman's daughter, who is at a crossroads in her life.",2000-10-01,6.860503804653138
2898,As Good as It Gets,1997,946,7,9.374049000000001,"New York City. Melvin Udall, a cranky, bigoted, obsessive-compulsive writer, finds his life turned upside down when neighboring gay artist Simon is hospitalized and his dog is entrusted to Melvin. In addition, Carol, the only waitress who will tolerate him, must leave work to care for her sick son, making it impossible for Melvin to eat breakfast.",1997-12-19,6.8601002087557115
1587,What's Eating Gilbert Grape,1993,943,7,10.3919,"Gilbert has to care for his brother Arnie and his obese mother, which gets in the way when love walks into his life.",1993-12-17,6.859694270682656
10515,Castle in the Sky,1986,877,7,11.061551,"The orphan Sheeta inherited a mysterious crystal that links her to the mythical sky-kingdom of Laputa. With the help of resourceful Pazu and a rollicking band of sky pirates, she makes her way to the ruins of the once-great civilization. Sheeta and Pazu must outwit the evil Muska, who plans to use Laputa's science to make himself ruler of the world.",1986-08-02,6.850126982600266
20453,3 Idiots,2009,850,7,7.6756210000000005,"In the tradition of “Ferris Bueller’s Day Off” comes this refreshing comedy about a rebellious prankster with a crafty mind and a heart of gold. Rascal. Joker. Dreamer. Genius... You've never met a college student quite like ""Rancho."" From the moment he arrives at India's most prestigious university, Rancho's outlandish schemes turn the campus upside down—along with the lives of his two newfound best friends. Together, they make life miserable for ""Virus,"" the school’s uptight and heartless dean. But when Rancho catches the eye of the dean's sexy daughter, Virus sets his sights on flunking out the ""3 idiots"" once and for all.",2009-12-23,6.845826237069612
1443,The Virgin Suicides,1999,841,7,10.505386999999999,"A group of male friends become obsessed with five mysterious sisters who are sheltered by their strict, religious parents.",1999-04-21,6.844337274877989
8055,The Reader,2008,835,7,7.931732000000001,"The story of Michael Berg, a German lawyer who, as a teenager in the late 1950s, had an affair with an older woman, Hanna, who then disappeared only to resurface years later as one of the defendants in a war crimes trial stemming from her actions as a concentration camp guard late in the war. He alone realizes that Hanna is illiterate and may be concealing that fact at the expense of her freedom.",2008-12-10,6.843328552174962
228326,The Book of Life,2014,778,7,10.337994,"The journey of Manolo, a young man who is torn between fulfilling the expectations of his family and following his heart. Before choosing which path to follow, he embarks on an incredible adventure that spans three fantastical worlds where he must face his greatest fears.",2014-10-01,6.8330508763480236
239571,The Best of Me,2014,777,7,8.196975,A pair of former high school sweethearts reunite after many years when they return to visit their small hometown.,2014-10-16,6.83285851648669
319,True Romance,1993,762,7,17.189328,"Clarence marries hooker Alabama, steals cocaine from her pimp, and tries to sell it in Hollywood, while the owners of the coke try to reclaim it.",1993-09-09,6.829918989868446
9361,The Last of the Mohicans,1992,747,7,15.228794,"As the English and French soldiers battle for control of the American colonies in the 18th century, the settlers and native Americans are forced to take sides. Cora and her sister Alice unwittingly walk into trouble but are reluctantly saved by Hawkeye, an orphaned settler adopted by the last of the Mohicans.",1992-09-25,6.826874217041172
872,Singin' in the Rain,1952,747,7,11.064858000000001,"In 1927 Hollywood, Don Lockwood and Lina Lamont are a famous on-screen romantic pair in silent movies, but Lina mistakes the on-screen romance for real love. When their latest film is transformed into a musical, Don has the perfect voice for the songs, but strident voice faces the studio to dub her voice. Aspiring actress, Kathy Selden is brought in and, while she is working on the movie, Don falls in love with her.",1952-04-10,6.826874217041172
1262,Stranger Than Fiction,2006,743,7,10.798092,"Everybody knows that your life is a story. But what if a story was your life? Harold Crick is your average IRS agent: monotonous, boring, and repetitive. But one day this all changes when Harold begins to hear an author inside his head narrating his life. But when the narration reveals he is going to die, Harold must find the author and convince them to change the ending.",2006-09-09,6.82604377798153
