id,title,year,vote_count,vote_average,popularity,overview,release_date,wr
19404,Dilwale Dulhania Le Jayenge,1995,661,9,34.457024,"Raj is a rich, carefree, happy-go-lucky second generation NRI. Simran is the daughter of Chaudhary Baldev Singh, who in spite of being an NRI is very strict about adherence to Indian values. Simran has left for India to be married to her childhood fiancé. Raj leaves for India with a mission at his hands, to claim his lady love under the noses of her whole family. Thus begins a saga.",1995-10-20,8.565285152891073
13,Forrest Gump,1994,8147,8,48.307194,"A man with a low IQ has accomplished great things in his life and been present during significant historic events - in each case, far exceeding what anyone imagined he could do. Yet, despite all the things he has attained, his one true love eludes him. 'Forrest Gump' is the story of a man who rose above his challenges, and who proved that determination, courage, and love are more important than ability.",1994-07-06,7.971356523684288
426,Vertigo,1958,1162,8,18.20822,"A retired San Francisco detective suffering from acrophobia investigates the strange activities of an old friend's wife, all the while becoming dangerously obsessed with her.",1958-05-09,7.8116672571304955
372058,Your Name.,2016,1030,8,34.461252,"High schoolers Mitsuha and Taki are complete strangers living separate lives. But one night, they suddenly switch places. Mitsuha wakes up in Taki’s body, and he in hers. This bizarre occurrence continues to happen randomly, and the two must adjust their lives around each other.",2016-08-26,7.789488720188062
239,Some Like It Hot,1959,835,8,11.845107,"Two musicians witness a mob hit and struggle to find a way out of the city before they are found by the gangsters. Their only opportunity is to join an all-girl band as they leave on a tour. To make their getaway they must first disguise themselves as women, then keep their identities secret and deal with the problems this brings - such as an attractive bandmate and a very determined suitor.",1959-03-18,7.745153803281994
11216,Cinema Paradiso,1988,834,8,14.177005,"A filmmaker recalls his childhood, when he fell in love with the movies at his village's theater and formed a deep friendship with the theater's projectionist.",1988-11-17,7.744878264092116
140420,Paperman,2012,734,8,7.198633,An urban office worker finds that paper airplanes are instrumental in meeting a girl in ways he never expected.,2012-11-02,7.713950668515939
369557,Sing Street,2016,669,8,10.672862,A boy growing up in Dublin during the 1980s escapes his strained family life by starting a band to impress the mysterious girl he likes.,2016-03-11,7.689482703590997
284,The Apartment,1960,498,8,11.994280999999999,"Bud Baxter is a minor clerk in a huge New York insurance company, until he discovers a quick way to climb the corporate ladder. He lends out his apartment to the executives as a place to take their mistresses. Although he often has to deal with the aftermath of their visits, one night he's left with a major problem to solve.",1960-06-15,7.599317212529798
290098,The Handmaiden,2016,453,8,16.727405,"1930s Korea, in the period of Japanese occupation, a new girl (Sookee) is hired as a handmaiden to a Japanese heiress (Hideko) who lives a secluded life on a large countryside estate with her domineering Uncle (Kouzuki). But the maid has a secret. She is a pickpocket recruited by a swindler posing as a Japanese Count to help him seduce the Lady to elope with him, rob her of her fortune, and lock her up in a madhouse. The plan seems to proceed according to plan until Sookee and Hideko discover some unexpected emotions.",2016-06-01,7.566166402755651
901,City Lights,1931,444,8,10.891524,City Lights is the first silent film that Charlie Chaplin directed after he established himself with sound accompanied films. The film is about a penniless man who falls in love with a flower girl. The film was a great success and today is deemed a cult classic.,1931-01-30,7.558866903082442
237791,The Way He Looks,2014,262,8,5.7112739999999995,"Leonardo is a blind teenager dealing with an overprotective mother while trying to live a more independent life. To the disappointment of his best friend, Giovana, he plans to go on an exchange program abroad. When Gabriel, a new student in town, arrives at their classroom, new feelings blossom in Leonardo making him question his plans.",2014-03-28,7.331362727284778
455661,In a Heartbeat,2017,146,8,20.82178,A closeted boy runs the risk of being outed by his own heart after it pops out of his chest to chase down the boy of his dreams.,2017-06-01,7.003959081717172
597,Titanic,1997,7770,7,26.88907,"84 years later, a 101-year-old woman named Rose DeWitt Bukater tells the story to her granddaughter Lizzy Calvert, Brock Lovett, Lewis Bodine, Bobby Buell and Anatoly Mikailavich on the Keldysh about her life set in April 10th 1912, on a ship called Titanic when young Rose boards the departing ship with the upper-class passengers and her mother, Ruth DeWitt Bukater, and her fiancé, Caledon Hockley. Meanwhile, a drifter and artist named Jack Dawson and his best friend Fabrizio De Rossi win third-class tickets to the ship in a game. And she explains the whole story from departure until the death of Titanic on its first and last voyage April 15th, 1912 at 2:20 in the morning.",1997-11-18,6.981546375918635
82693,Silver Linings Playbook,2012,4840,7,14.488110999999998,"After spending eight months in a mental institution, a former teacher moves back in with his parents and tries to reconcile with his ex-wife.",2012-09-08,6.970581010861871
313369,La La Land,2016,4745,7,19.681686,"Mia, an aspiring actress, serves lattes to movie stars in between auditions and Sebastian, a jazz musician, scrapes by playing cocktail party gigs in dingy bars, but as success mounts they are faced with decisions that begin to fray the fragile fabric of their love affair, and the dreams they worked so hard to maintain in each other threaten to rip them apart.",2016-11-29,6.970003082458032
102651,Maleficent,2014,4607,7,19.467404000000002,"The untold story of Disney's most iconic villain from the 1959 classic 'Sleeping Beauty'. A beautiful, pure-hearted young woman, Maleficent has an idyllic life growing up in a peaceable forest kingdom, until one day when an invading army threatens the harmony of the land.  Maleficent rises to be the land's fiercest protector, but she ultimately suffers a ruthless betrayal – an act that begins to turn her heart into stone. Bent on revenge, Maleficent faces an epic battle with the invading King's successor and, as a result, places a curse upon his newborn infant Aurora. As the child grows, Maleficent realizes that Aurora holds the key to peace in the kingdom - and to Maleficent's true happiness as well.",2014-05-28,6.969121928193192
152601,Her,2013,4215,7,13.829514999999999,"In the not so distant future, Theodore, a lonely writer purchases a newly developed operating system designed to meet the user's every needs. To Theordore's surprise, a romantic relationship develops between him and his operating system. This unconventional love story blends science fiction and romance in a sweet tale that explores the nature of love and the ways that technology isolates and connects us all.",2013-12-18,6.966310854051138
64682,The Great Gatsby,2013,3885,7,17.598936,"An adaptation of F. Scott Fitzgerald's Long Island-set novel, where Midwesterner Nick Carraway is lured into the lavish world of his neighbor, Jay Gatsby. Soon enough, however, Carraway will see through the cracks of Gatsby's nouveau riche existence, where obsession, madness, and tragedy await.",2013-05-10,6.963514652395382
222935,The Fault in Our Stars,2014,3868,7,16.274653,"Despite the tumor-shrinking medical miracle that has bought her a few years, Hazel has never been anything but terminal, her final chapter inscribed upon diagnosis. But when a patient named Augustus Waters suddenly appears at Cancer Kid Support Group, Hazel's story is about to be completely rewritten.",2014-05-16,6.963357979857737
38,Eternal Sunshine of the Spotless Mind,2004,3758,7,12.906327000000001,"Joel Barish, heartbroken that his girlfriend underwent a procedure to erase him from her memory, decides to do the same. However, as he watches his memories of her fade away, he realises that he still loves her, and may be too late to correct his mistake.",2004-03-19,6.962310765792512
162,Edward Scissorhands,1990,3731,7,17.612244,A small suburban town receives a visit from a castaway unfinished science experiment named Edward.,1990-12-05,6.962044508348936
812,Aladdin,1992,3495,7,16.357419,"Princess Jasmine grows tired of being forced to remain in the palace and she sneaks out into the marketplace  in disguise where she meets street-urchin Aladdin and the two fall in love, although she may only marry a prince. After being thrown in jail, Aladdin and becomes embroiled in a plot to find a mysterious lamp with which the evil Jafar hopes to rule the land.",1992-11-25,6.959546531263782
194,Amélie,2001,3403,7,12.879381,"At a tiny Parisian café, the adorable yet painfully shy Amélie (Audrey Tautou) accidentally discovers a gift for helping others. Soon Amelie is spending her days as a matchmaker, guardian angel, and all-around do-gooder. But when she bumps into a handsome stranger, will she find the courage to become the star of her very own love story?",2001-04-25,6.958481326442885
266856,The Theory of Everything,2014,3403,7,11.853019999999999,"The Theory of Everything is the extraordinary story of one of the world’s greatest living minds, the renowned astrophysicist Stephen Hawking, who falls deeply in love with fellow Cambridge student Jane Wilde.",2014-11-26,6.958481326442885
4922,The Curious Case of Benjamin Button,2008,3398,7,17.934821,"Tells the story of Benjamin Button, a man who starts aging backwards with bizarre consequences.",2008-11-24,6.958421825348619
350,The Devil Wears Prada,2006,3198,7,13.102383999999999,The Devil Wears Prada is about a young journalist who moves to New York to work in the fashion industry. Her boss however is extremely demanding and cruel and won’t let her succeed if she doesn’t fit into the high class elegant look of their magazine when all she really wants to be a good journalist.,2006-06-30,6.955893431377907
11036,The Notebook,2004,3163,7,15.239013,"An epic love story centered around an older man who reads aloud to a woman with Alzheimer's. From a faded notebook, the old man's words bring to life the story about a couple who is separated by World War II, and is then passionately reunited, seven years later, after they have taken different paths.",2004-06-25,6.955419006871384
453,A Beautiful Mind,2001,3087,7,11.93646,"At Princeton University, John Nash struggles to make a worthwhile contribution to serve as his legacy to the world of mathematics. He finally makes a revolutionary breakthrough that will eventually earn him the Nobel Prize. After graduate school he turns to teaching, becoming romantically involved with his student Alicia. Meanwhile the government asks his help with breaking Soviet codes, which soon gets him involved in a terrifying conspiracy plot. Nash grows more and more paranoid until a discovery that turns his entire world upside down. Now it is only with Alicia's help that he will be able to recover his mental strength and regain his status as the great mathematician we know him as today..",2001-12-11,6.9543528451048795
84892,The Perks of Being a Wallflower,2012,3056,7,12.775679,"A coming-of-age story based on the best-selling novel by Stephen Chbosky, which follows 15-year-old freshman Charlie, an endearing and naive outsider who is taken under the wings of two seniors. A moving tale of love, loss, fear and hope - and the unforgettable friends that help us through life.",2012-09-20,6.9539031766051655
10020,Beauty and the Beast,1991,3029,7,23.433511,"Follow the adventures of Belle, a bright young woman who finds herself in the castle of a prince who's been turned into a mysterious beast. With the help of the castle's enchanted staff, Belle soon learns the most important lesson of all -- that true beauty comes from within.",1991-11-13,6.953504249001186
19913,(500) Days of Summer,2009,2993,7,16.376657,"Tom (Joseph Gordon-Levitt), greeting-card writer and hopeless romantic, is caught completely off-guard when his girlfriend, Summer (Zooey Deschanel), suddenly dumps him. He reflects on their 500 days together to try to figure out where their love affair went sour, and in doing so, Tom rediscovers his true passions in life.",2009-07-17,6.952961479444469
12405,Slumdog Millionaire,2008,2918,7,11.258181,"Jamal Malik is an impoverished Indian teen who becomes a contestant on the Hindi version of ‘Who Wants to Be a Millionaire?’ but, after he wins, he is suspected of cheating.",2008-05-12,6.951788994801688
296096,Me Before You,2016,2674,7,34.34759,"A small town girl is caught between dead-end jobs. A high-profile, successful man becomes wheelchair bound following an accident. The man decides his life is not worth living until the girl is hired for six months to be his new caretaker. Worlds apart and trapped together by circumstance, the two get off to a rocky start. But the girl becomes determined to prove to the man that life is worth living and as they embark on a series of adventures together, each finds their world changing in ways neither of them could begin to imagine.",2016-06-02,6.947534415877174
50646,"Crazy, Stupid, Love.",2011,2522,7,10.246172999999999,"Cal Weaver is living the American dream. He has a good job, a beautiful house, great children and a beautiful wife, named Emily. Cal's seemingly perfect life unravels, however, when he learns that Emily has been unfaithful and wants a divorce. Over 40 and suddenly single, Cal is adrift in the fickle world of dating. Enter, Jacob Palmer, a self-styled player who takes Cal under his wing and teaches him how to be a hit with the ladies.",2011-07-29,6.944482340104405
137,Groundhog Day,1993,2358,7,12.989627,"A narcissistic TV weatherman, along with his attractive-but-distant producer and mawkish cameraman, is sent to report on Groundhog Day in the small town of Punxsutawney, where he finds himself repeating the same day over and over.",1993-02-11,6.940764386646576
7326,Juno,2007,2313,7,11.791591,"A young girl named Juno gets herself pregnant and tries to stand on her own, but soon learns a few lessons about being grown up.",2007-12-05,6.939655520803194
114150,Pitch Perfect,2012,2310,7,11.03595,"College student Beca knows she does not want to be part of a clique, but that's exactly where she finds herself after arriving at her new school. Thrust in among mean gals, nice gals and just plain weird gals, Beca finds that the only thing they have in common is how well they sing together. She takes the women of the group out of their comfort zone of traditional arrangements and into a world of amazing harmonic combinations in a fight to the top of college music competitions.",2012-09-28,6.939580118480069
293863,The Age of Adaline,2015,2052,7,10.542026,"After 29-year-old Adaline recovers from a nearly lethal accident, she inexplicably stops growing older. As the years stretch on and on, Adaline keeps her secret to herself  until she meets a man who changes her life.",2015-04-16,6.932305710233234
59436,Midnight in Paris,2011,2049,7,11.43256,A romantic comedy about a family traveling to the French capital for business. The party includes a young engaged couple forced to confront the illusion that a life different from their own is better.,2011-05-11,6.93221080726146
18438,Castaway on the Moon,2009,130,8,6.266701,"Mr. Kim is jobless, lost in debt and has been dumped by his girlfriend. He decides to end it all by jumping into the Han River - only to find himself washed up on a small, mid-river island. He soon abandons thoughts of suicide or rescue and begins a new life as a castaway. His antics catch the attention of a young woman whose apartment overlooks the river. Her discovery changes both their lives.",2009-05-14,6.931814877586229
3933,Corpse Bride,2005,1957,7,12.920032,"Set in a 19th-century european village, this stop-motion animation feature follows the story of Victor, a young man whisked away to the underworld and wed to a mysterious corpse bride, while his real bride Victoria waits bereft in the land of the living.",2005-09-09,6.9291654409193795
82695,Les Misérables,2012,1925,7,13.52408,"An adaptation of the successful stage musical based on Victor Hugo's classic novel set in 19th-century France, in which a paroled prisoner named Jean Valjean seeks redemption.",2012-12-18,6.928041027064238
508,Love Actually,2003,1917,7,10.586815,Follows seemingly unrelated people as their lives begin to intertwine while they fall in – and out – of love. Affections languish and develop as Christmas draws near.,2003-09-07,6.927754323650978
782,Gattaca,1997,1846,7,12.89312,"Science fiction drama about a future society in the era of indefinite eugenics where humans are set on a life course depending on their DNA. The young Vincent Freeman is born with a condition that would prevent him from space travel, yet he is determined to infiltrate the GATTACA space program.",1997-09-07,6.925106049077803
114,Pretty Woman,1990,1807,7,13.348451,"When millionaire wheeler-dealer Edward Lewis enters a business contract with Hollywood hooker Vivian Ward, he loses his heart in the bargain in this charming romantic comedy. After Edward hires Vivian as his date for a week and gives her a Cinderella makeover, she returns the favor by mellowing the hardnosed tycoon's outlook. Can the poor prostitute and the rich capitalist live happily ever after?",1990-03-23,6.923567051192791
4951,10 Things I Hate About You,1999,1768,7,12.069966,"Bianca, a tenth grader, has never gone on a date, but she isn't allowed to go out with boys until her older sister Kat gets a boyfriend. The problem is, Kat rubs nearly everyone the wrong way. But Bianca and the guy she has her eye on, Joey, are eager, so Joey fixes Kat up with Patrick, a new kid in town just bitter enough for Kat.",1999-03-30,6.921963476496207
11970,Hercules,1997,1741,7,14.048694,"Bestowed with superhuman strength, a young mortal named Hercules sets out to prove himself a hero in the eyes of his father, the great god Zeus. Along with his friends Pegasus, a flying horse, and Phil, a personal trainer, Hercules is tricked by the hilarious, hotheaded villain Hades, who's plotting to take over Mount Olympus!",1997-06-26,6.920813312112451
83666,Moonrise Kingdom,2012,1701,7,8.692433,"Set on an island off the coast of New England in the summer of 1965, Moonrise Kingdom tells the story of two twelve-year-olds who fall in love, make a secret pact, and run away together into the wilderness. As various authorities try to hunt them down, a violent storm is brewing off-shore – and the peaceful island community is turned upside down in more ways than anyone can handle.",2012-05-16,6.919045653473296
200727,"Love, Rosie",2014,1660,7,14.566103,Rosie and Alex are best friends. They are suddenly separated when Alex and his family move from Dublin to America. Can their friendship survive years and miles? Will they gamble everything for true love?,2014-10-16,6.917149983699125
1491,The Illusionist,2006,1657,7,11.494009,"With his eye on a lovely aristocrat, a gifted illusionist named Eisenheim uses his powers to win her away from her betrothed, a crowned prince. But Eisenheim's scheme creates tumult within the monarchy and ignites the suspicion of a dogged inspector.",2006-08-18,6.917007784460665
621,Grease,1978,1633,7,7.8548990000000005,"Australian good girl Sandy and greaser Danny fell in love over the summer. But when they unexpectedly discover they're now in the same high school, will they be able to rekindle their romance despite their eccentric friends?",1978-07-07,6.915852373373628
31011,Mr. Nobody,2009,1616,7,11.817059,"Nemo Nobody leads an ordinary existence with his wife and 3 children; one day, he wakes up as a mortal centenarian in the year 2092.",2009-09-11,6.91501429870455
184,Jackie Brown,1997,1580,7,16.415498,"Jackie Brown is a flight attendant who gets caught in the middle of smuggling cash into the country for her gunrunner boss. When the cops try to use Jackie to get to her boss, she hatches a plan—with help from a bail bondsman—to keep the money for herself. Based on Elmore Leonard's novel “Rum Punch”.",1997-12-24,6.913183258398945
334533,Captain Fantastic,2016,1569,7,16.519276,A father living in the forests of the Pacific Northwest with his six young kids tries to assimilate back into society.,2016-07-02,6.9126079320795215
628,Interview with the Vampire,1994,1558,7,11.970205,"A vampire relates his epic life story of love, betrayal, loneliness, and dark hunger to an over-curious reporter.",1994-11-11,6.9120249296250815
142,Brokeback Mountain,2005,1531,7,11.787044,Brokeback Mountain is an Ang Lee film about two modern day cowboys who meet on a shepherding job in the summer of ’63. The two share a raw and powerful summer together that turns into a life long relationship conflicting with the lives they are supposed to live.,2005-09-02,6.910560396114926
2493,The Princess Bride,1987,1518,7,15.15267,"In this enchantingly cracked fairy tale, the beautiful Princess Buttercup and the dashing Westley must overcome staggering odds to find happiness amid six-fingered swordsmen, murderous princes, Sicilians and rodents of unusual size. But even death can't stop these true lovebirds from triumphing.",1987-09-18,6.909837719223568
289,Casablanca,1942,1462,7,13.916101000000001,"In Casablanca, Morocco in December 1941, a cynical American expatriate meets a former lover, with unforeseen complications.",1942-11-26,6.906586326523793
4348,Pride & Prejudice,2005,1406,7,14.439082999999998,"Pride & Prejudice is a humorous story of love and life among English gentility during the Georgian era. Mr. Bennet is an English gentleman living in Hertfordshire with his overbearing wife and five daughters. If Mr. Bennet dies their house will be inherited by a distant cousin whom they have never met, so the family's future happiness and security is dependent on the daughters making good marriages.",2005-09-16,6.9030916604040335
19542,The Red Shoes,1948,124,8,10.44551,"In this classic drama, Vicky Page is an aspiring ballerina torn between her dedication to dance and her desire to love. While her imperious instructor, Boris Lermontov, urges to her to forget anything but ballet, Vicky begins to fall for the charming young composer Julian Craster. Eventually Vicky, under great emotional stress, must choose to pursue either her art or her romance, a decision that carries serious consequences.",1948-07-20,6.901991188733354
88,Dirty Dancing,1987,1371,7,14.044122,"Expecting the usual tedium that accompanies a summer in the Catskills with her family, 17-year-old Frances 'Baby' Houseman is surprised to find herself stepping into the shoes of a professional hoofer – and unexpectedly falling in love.",1987-08-21,6.900771534618509
824,Moulin Rouge!,2001,1348,7,13.691781,"A celebration of love and creative inspiration takes place in the infamous, gaudy and glamorous Parisian nightclub, at the cusp of the 20th century. A young poet, who is plunged into the heady world of Moulin Rouge, begins a passionate affair with the club's most notorious and beautiful star.",2001-03-09,6.899185423906316
72570,The Vow,2012,1328,7,9.524298,"Happy young married couple Paige and Leo are, well, happy. Then a car accident puts Paige into a life-threatening coma. Upon awakening she has lost the previous five years of memories, including those of her beloved Leo, her wedding, a confusing relationship with her parents, or the ending of her relationship with her ex-fiance. Despite these complications, Leo endeavors to win her heart again and rebuild their marriage.",2012-02-05,6.897764399505813
5544,Hiroshima Mon Amour,1959,123,8,6.953676,A French actress filming an anti-war film in Hiroshima has an affair with a married Japanese architect as they share their differing perspectives on war.,1959-06-10,6.896857907708265
509,Notting Hill,1999,1309,7,9.874042999999999,The British comedy from director Roger Michell tells the love story between a famous actress and a simple book seller from London. A look into the attempt for famous people to have a personal and private life and the ramifications that follow. Nominated for three Golden Globes in 2000.,1999-05-13,6.8963768172432305
198277,Begin Again,2013,1285,7,10.289628,"Gretta's celebrity boyfriend breaks up with her after a long-term relationship, leaving the singer to find success on her own. With the help of record producer, Dan and hip-hop celebrity, Trouble Gum, Gretta strives to fulfil her musical ambitions.",2013-09-07,6.894569304788718
167073,Brooklyn,2015,1235,7,7.991613,"In 1950s Ireland and New York, young Ellis Lacey has to choose between two men and two countries.",2015-10-20,6.8905934885427245
2270,Stardust,2007,1215,7,14.784525,"In a countryside town bordering on a magical land, a young man makes a promise to his beloved that he'll retrieve a fallen star by venturing into the magical realm. His journey takes him into a world beyond his wildest dreams and reveals his true identity.",2007-08-09,6.88891791596508
116,Match Point,2005,1134,7,9.020372,"Match Point is Woody Allen’s satire of the British High Society and the ambition of a young tennis instructor to enter into it. Yet when he must decide between two women - one assuring him his place in high society, and the other that would bring him far from it - palms start to sweat and a dark psychological match in his head begins.",2005-10-26,6.881572296888561
